{
  "schema": {
    "name": "trivia_v1",
    "version": "1.0.0"
  },
  "players": [
    {
      "player_id": "drew_brees",
      "full_name": "Drew Brees",
      "pos": "QB",
      "college": "Purdue",
      "birthdate": "1979-01-15",
      "fun_fact": null
    },
    {
      "player_id": "kirk_cousins",
      "full_name": "Kirk Cousins",
      "pos": "QB",
      "college": "Michigan St.",
      "birthdate": "1988-08-19",
      "fun_fact": null
    },
    {
      "player_id": "larry_fitzgerald",
      "full_name": "Larry Fitzgerald",
      "pos": "WR",
      "college": "Pittsburgh",
      "birthdate": "1983-08-31",
      "fun_fact": null
    }
  ],
  "qb_seasons": [
    {
      "player_id": "drew_brees",
      "season": 2001,
      "age": 22,
      "team_full": "San Diego Chargers",
      "team_abbrs": "SDG",
      "pos": "QB",
      "G": 1,
      "GS": 0,
      "Awards": [],
      "multi_team": false,
      "Cmp": 15,
      "Att": 27,
      "CmpPct": 55.6,
      "Yds": 12,
      "TD": 1,
      "Int": 0,
      "Rate": 94.8,
      "Sk": 2,
      "SkYds": 0,
      "Y/A": 8.2,
      "AY/A": 8.93,
      "Y/C": 14.7,
      "Y/G": 221,
      "NY/A": 7.21,
      "ANY/A": 7.9,
      "4QC": 0,
      "GWD": 0
    },
    {
      "player_id": "drew_brees",
      "season": 2001,
      "age": 22,
      "team_full": "San Diego Chargers",
      "team_abbrs": "SDG",
      "pos": "QB",
      "G": 1,
      "GS": 0,
      "Awards": [],
      "multi_team": false,
      "Cmp": 15,
      "Att": 27,
      "CmpPct": 55.6,
      "Yds": 12,
      "TD": 1,
      "Int": 0,
      "Rate": 94.8,
      "Sk": 2,
      "SkYds": 0,
      "Y/A": 8.2,
      "AY/A": 8.93,
      "Y/C": 14.7,
      "Y/G": 221,
      "NY/A": 7.21,
      "ANY/A": 7.9,
      "4QC": 0,
      "GWD": 0
    },
    {
      "player_id": "drew_brees",
      "season": 2002,
      "age": 23,
      "team_full": "San Diego Chargers",
      "team_abbrs": "SDG",
      "pos": "QB",
      "G": 16,
      "GS": 16,
      "Awards": [],
      "multi_team": false,
      "Cmp": 320,
      "Att": 526,
      "CmpPct": 60.8,
      "Yds": 180,
      "TD": 17,
      "Int": 16,
      "Rate": 76.9,
      "Sk": 24,
      "SkYds": 0,
      "Y/A": 6.2,
      "AY/A": 5.52,
      "Y/C": 10.3,
      "Y/G": 205.3,
      "NY/A": 5.64,
      "ANY/A": 4.95,
      "4QC": 2,
      "GWD": 4
    },
    {
      "player_id": "drew_brees",
      "season": 2002,
      "age": 23,
      "team_full": "San Diego Chargers",
      "team_abbrs": "SDG",
      "pos": "QB",
      "G": 16,
      "GS": 16,
      "Awards": [],
      "multi_team": false,
      "Cmp": 320,
      "Att": 526,
      "CmpPct": 60.8,
      "Yds": 180,
      "TD": 17,
      "Int": 16,
      "Rate": 76.9,
      "Sk": 24,
      "SkYds": 0,
      "Y/A": 6.2,
      "AY/A": 5.52,
      "Y/C": 10.3,
      "Y/G": 205.3,
      "NY/A": 5.64,
      "ANY/A": 4.95,
      "4QC": 2,
      "GWD": 4
    },
    {
      "player_id": "drew_brees",
      "season": 2003,
      "age": 24,
      "team_full": "San Diego Chargers",
      "team_abbrs": "SDG",
      "pos": "QB",
      "G": 11,
      "GS": 11,
      "Awards": [],
      "multi_team": false,
      "Cmp": 205,
      "Att": 356,
      "CmpPct": 57.6,
      "Yds": 178,
      "TD": 11,
      "Int": 15,
      "Rate": 67.5,
      "Sk": 21,
      "SkYds": 0,
      "Y/A": 5.9,
      "AY/A": 4.64,
      "Y/C": 10.3,
      "Y/G": 191.6,
      "NY/A": 5.12,
      "ANY/A": 3.91,
      "4QC": 0,
      "GWD": 1
    },
    {
      "player_id": "drew_brees",
      "season": 2003,
      "age": 24,
      "team_full": "San Diego Chargers",
      "team_abbrs": "SDG",
      "pos": "QB",
      "G": 11,
      "GS": 11,
      "Awards": [],
      "multi_team": false,
      "Cmp": 205,
      "Att": 356,
      "CmpPct": 57.6,
      "Yds": 178,
      "TD": 11,
      "Int": 15,
      "Rate": 67.5,
      "Sk": 21,
      "SkYds": 0,
      "Y/A": 5.9,
      "AY/A": 4.64,
      "Y/C": 10.3,
      "Y/G": 191.6,
      "NY/A": 5.12,
      "ANY/A": 3.91,
      "4QC": 0,
      "GWD": 1
    },
    {
      "player_id": "drew_brees",
      "season": 2004,
      "age": 25,
      "team_full": "San Diego Chargers",
      "team_abbrs": "SDG",
      "pos": "QB",
      "G": 15,
      "GS": 15,
      "Awards": [
        "OPOY"
      ],
      "multi_team": false,
      "Cmp": 262,
      "Att": 400,
      "CmpPct": 65.5,
      "Yds": 131,
      "TD": 27,
      "Int": 7,
      "Rate": 104.8,
      "Sk": 18,
      "SkYds": 0,
      "Y/A": 7.9,
      "AY/A": 8.46,
      "Y/C": 12.1,
      "Y/G": 210.6,
      "NY/A": 7.24,
      "ANY/A": 7.78,
      "4QC": 1,
      "GWD": 2
    },
    {
      "player_id": "drew_brees",
      "season": 2004,
      "age": 25,
      "team_full": "San Diego Chargers",
      "team_abbrs": "SDG",
      "pos": "QB",
      "G": 1,
      "GS": 1,
      "Awards": [],
      "multi_team": false,
      "Cmp": 31,
      "Att": 42,
      "CmpPct": 73.8,
      "Yds": 11,
      "TD": 2,
      "Int": 1,
      "Rate": 101.2,
      "Sk": 2,
      "SkYds": 0,
      "Y/A": 7.6,
      "AY/A": 7.48,
      "Y/C": 10.3,
      "Y/G": 319,
      "NY/A": 7,
      "ANY/A": 6.89,
      "4QC": 0,
      "GWD": 0
    },
    {
      "player_id": "drew_brees",
      "season": 2004,
      "age": 25,
      "team_full": "San Diego Chargers",
      "team_abbrs": "SDG",
      "pos": "QB",
      "G": 15,
      "GS": 15,
      "Awards": [
        "OPOY"
      ],
      "multi_team": false,
      "Cmp": 262,
      "Att": 400,
      "CmpPct": 65.5,
      "Yds": 131,
      "TD": 27,
      "Int": 7,
      "Rate": 104.8,
      "Sk": 18,
      "SkYds": 0,
      "Y/A": 7.9,
      "AY/A": 8.46,
      "Y/C": 12.1,
      "Y/G": 210.6,
      "NY/A": 7.24,
      "ANY/A": 7.78,
      "4QC": 1,
      "GWD": 2
    },
    {
      "player_id": "drew_brees",
      "season": 2004,
      "age": 25,
      "team_full": "San Diego Chargers",
      "team_abbrs": "SDG",
      "pos": "QB",
      "G": 1,
      "GS": 1,
      "Awards": [],
      "multi_team": false,
      "Cmp": 31,
      "Att": 42,
      "CmpPct": 73.8,
      "Yds": 11,
      "TD": 2,
      "Int": 1,
      "Rate": 101.2,
      "Sk": 2,
      "SkYds": 0,
      "Y/A": 7.6,
      "AY/A": 7.48,
      "Y/C": 10.3,
      "Y/G": 319,
      "NY/A": 7,
      "ANY/A": 6.89,
      "4QC": 0,
      "GWD": 0
    },
    {
      "player_id": "drew_brees",
      "season": 2005,
      "age": 26,
      "team_full": "San Diego Chargers",
      "team_abbrs": "SDG",
      "pos": "QB",
      "G": 16,
      "GS": 16,
      "Awards": [],
      "multi_team": false,
      "Cmp": 323,
      "Att": 500,
      "CmpPct": 64.6,
      "Yds": 223,
      "TD": 24,
      "Int": 15,
      "Rate": 89.2,
      "Sk": 27,
      "SkYds": 0,
      "Y/A": 7.2,
      "AY/A": 6.76,
      "Y/C": 11.1,
      "Y/G": 223.5,
      "NY/A": 6.36,
      "ANY/A": 5.99,
      "4QC": 2,
      "GWD": 2
    },
    {
      "player_id": "drew_brees",
      "season": 2005,
      "age": 26,
      "team_full": "San Diego Chargers",
      "team_abbrs": "SDG",
      "pos": "QB",
      "G": 16,
      "GS": 16,
      "Awards": [],
      "multi_team": false,
      "Cmp": 323,
      "Att": 500,
      "CmpPct": 64.6,
      "Yds": 223,
      "TD": 24,
      "Int": 15,
      "Rate": 89.2,
      "Sk": 27,
      "SkYds": 0,
      "Y/A": 7.2,
      "AY/A": 6.76,
      "Y/C": 11.1,
      "Y/G": 223.5,
      "NY/A": 6.36,
      "ANY/A": 5.99,
      "4QC": 2,
      "GWD": 2
    },
    {
      "player_id": "drew_brees",
      "season": 2006,
      "age": 27,
      "team_full": "New Orleans Saints",
      "team_abbrs": "NOR",
      "pos": "QB",
      "G": 16,
      "GS": 16,
      "Awards": [
        "MVP",
        "OPOY"
      ],
      "multi_team": false,
      "Cmp": 356,
      "Att": 554,
      "CmpPct": 64.3,
      "Yds": 105,
      "TD": 26,
      "Int": 11,
      "Rate": 96.2,
      "Sk": 18,
      "SkYds": 0,
      "Y/A": 8,
      "AY/A": 8.02,
      "Y/C": 12.4,
      "Y/G": 276.1,
      "NY/A": 7.54,
      "ANY/A": 7.58,
      "4QC": 1,
      "GWD": 2
    },
    {
      "player_id": "drew_brees",
      "season": 2006,
      "age": 27,
      "team_full": "New Orleans Saints",
      "team_abbrs": "NOR",
      "pos": "QB",
      "G": 2,
      "GS": 2,
      "Awards": [],
      "multi_team": false,
      "Cmp": 47,
      "Att": 81,
      "CmpPct": 58,
      "Yds": 51,
      "TD": 3,
      "Int": 1,
      "Rate": 88.3,
      "Sk": 6,
      "SkYds": 0,
      "Y/A": 7.4,
      "AY/A": 7.56,
      "Y/C": 12.7,
      "Y/G": 298.5,
      "NY/A": 6.28,
      "ANY/A": 6.45,
      "4QC": 0,
      "GWD": 0
    },
    {
      "player_id": "drew_brees",
      "season": 2006,
      "age": 27,
      "team_full": "New Orleans Saints",
      "team_abbrs": "NOR",
      "pos": "QB",
      "G": 16,
      "GS": 16,
      "Awards": [
        "MVP",
        "OPOY"
      ],
      "multi_team": false,
      "Cmp": 356,
      "Att": 554,
      "CmpPct": 64.3,
      "Yds": 105,
      "TD": 26,
      "Int": 11,
      "Rate": 96.2,
      "Sk": 18,
      "SkYds": 0,
      "Y/A": 8,
      "AY/A": 8.02,
      "Y/C": 12.4,
      "Y/G": 276.1,
      "NY/A": 7.54,
      "ANY/A": 7.58,
      "4QC": 1,
      "GWD": 2
    },
    {
      "player_id": "drew_brees",
      "season": 2006,
      "age": 27,
      "team_full": "New Orleans Saints",
      "team_abbrs": "NOR",
      "pos": "QB",
      "G": 2,
      "GS": 2,
      "Awards": [],
      "multi_team": false,
      "Cmp": 47,
      "Att": 81,
      "CmpPct": 58,
      "Yds": 51,
      "TD": 3,
      "Int": 1,
      "Rate": 88.3,
      "Sk": 6,
      "SkYds": 0,
      "Y/A": 7.4,
      "AY/A": 7.56,
      "Y/C": 12.7,
      "Y/G": 298.5,
      "NY/A": 6.28,
      "ANY/A": 6.45,
      "4QC": 0,
      "GWD": 0
    },
    {
      "player_id": "drew_brees",
      "season": 2007,
      "age": 28,
      "team_full": "New Orleans Saints",
      "team_abbrs": "NOR",
      "pos": "QB",
      "G": 16,
      "GS": 16,
      "Awards": [],
      "multi_team": false,
      "Cmp": 440,
      "Att": 652,